{
  "whatsapp": {
    "phoneNumber": "",
    "enabled": true,
    "baileys": {
      "printQRInTerminal": true,
      "syncFullHistory": false,
      "allowedEvents": [
        "messages.upsert",
        "connection.update",
        "creds.update"
      ]
    }
  },
  "llm": {
    "primaryProvider": "anthropic",
    "fallbackProvider": "gemini",
    "models": {
      "classify": {
        "provider": "anthropic",
        "model": "claude-haiku-4-5-20251001",
        "maxInputTokens": 2048,
        "maxOutputTokens": 512
      },
      "respond": {
        "provider": "anthropic",
        "model": "claude-sonnet-4-6-20250514",
        "maxInputTokens": 8192,
        "maxOutputTokens": 2048
      },
      "complex": {
        "provider": "anthropic",
        "model": "claude-opus-4-6-20250605",
        "maxInputTokens": 16384,
        "maxOutputTokens": 4096
      },
      "compress": {
        "provider": "gemini",
        "model": "gemini-2.5-flash",
        "maxInputTokens": 8192,
        "maxOutputTokens": 2048
      },
      "fallback": {
        "provider": "gemini",
        "model": "gemini-3-flash-preview",
        "maxInputTokens": 8192,
        "maxOutputTokens": 2048
      }
    },
    "availableModels": {
      "anthropic": [
        "claude-haiku-4-5-20251001",
        "claude-sonnet-4-6-20250514",
        "claude-opus-4-6-20250605",
        "claude-sonnet-4-5-20241022",
        "claude-opus-4-5-20250115"
      ],
      "gemini": [
        "gemini-3.1-pro-preview",
        "gemini-3-flash-preview",
        "gemini-3.1-flash-lite-preview",
        "gemini-2.5-pro",
        "gemini-2.5-flash",
        "gemini-2.5-flash-lite"
      ]
    }
  },
  "memory": {
    "bufferMessageCount": 50,
    "sessionInactivityTimeoutMinutes": 30,
    "sessionMaxTTLHours": 24,
    "compressionThreshold": 30,
    "compressionKeepRecent": 10
  },
  "channels": {
    "enabledChannels": [
      "whatsapp"
    ]
  }
}
